Название	Цена	Размер скидки	Мера веса/объема/цена за указанную меру	Старая цена	Ссылка на картинку
Жидкое мыло дезинфицирующее Sanipone Soft 1000мл	199.99	63	1 шт	546.19	https://photos.okolo.app/product/1206179-main/320x320.jpeg
Салфетки Tolli plus влажные универсальные с антибактериальным эффектом 120шт	169.99	0.0	1 шт	169.99	https://photos.okolo.app/product/1206016-main/320x320.jpeg
Маска одноразовая Home Textile санитарно-гигиеническая 9.5x17см 3шт в ассортименте	14.99	0.0	1 шт	14.99	https://photos.okolo.app/product/1205150-main/320x320.jpeg
Мыло жидкое Absolut Nature Алоэ антибактериальное, 500мл	167.99	0.0	1 шт	167.99	https://photos.okolo.app/product/1195847-main/320x320.jpeg
Салфетки влажные Tolli Plus антибактериальные с экстрактом ромашки, 80шт	139.99	0.0	1 шт	139.99	https://photos.okolo.app/product/1188095-main/320x320.jpeg
Мыло жидкое Bodyart Морские минералы антибактериальное, 500мл	129.99	0.0	1 шт	129.99	https://photos.okolo.app/product/1185171-main/320x320.jpeg
Салфетки влажные Tolli Plus антисептические 15шт	49.99	0.0	1 шт	49.99	https://photos.okolo.app/product/1181499-main/320x320.jpeg
Гель для рук Tolli Plus Антибактериальный эффект, 60мл	49.99	38	1 шт	79.99	https://photos.okolo.app/product/1180690-main/320x320.jpeg
Мыло Absolut с маслом чайного дерева, 90г	41.99	0.0	1 шт	41.99	https://photos.okolo.app/product/1159530-main/320x320.jpeg
