Название;Цена;Размер скидки;Мера веса/объема/цена за указанную меру;Старая цена;Ссылка на картинку
Чай Принцесса Нури Высокогорный чёрный в пакетиках, 25х2г;52.99;29;1 шт;74.49;https://photos.okolo.app/product/1159293-main/320x320.jpeg
Чай зеленый Принцесса Ява Традиционный 25 пак;47.99;0.0;1 шт;47.99;https://photos.okolo.app/product/1159193-main/320x320.jpeg
Чай Akbar Akbar Mountain чёрный в пакетиках, 25х2г;59.99;0.0;1 шт;59.99;https://photos.okolo.app/product/1157263-main/320x320.jpeg
Какао-порошок Золотой Ярлык 100г;126.99;0.0;1 шт;126.99;https://photos.okolo.app/product/1157258-main/320x320.jpeg
Напиток кофейный MacCoffee Original 3в1 растворимый, 20г;16.49;0.0;1 шт;16.49;https://photos.okolo.app/product/1157239-main/320x320.jpeg
Кофе Jacobs Monarch натуральный растворимый сублимированный, 190г;758.99;0.0;1 шт;758.99;https://photos.okolo.app/product/1158559-main/320x320.jpeg
Чай Ahmad Tea Earl Grey чёрный, 100х2г;359.99;31;1 шт;519.99;https://photos.okolo.app/product/1158374-main/320x320.jpeg
Чай Greenfield Золотой Цейлон чёрный в пакетиках, 25х2г;128.99;0.0;1 шт;128.99;https://photos.okolo.app/product/1158245-main/320x320.jpeg
Чай Greenfield Flying Dragon зелёный крупнолистовой, 100г;129.99;31;1 шт;188.99;https://photos.okolo.app/product/1158244-main/320x320.jpeg
Чай Greenfield Золотой Цейлон чёрный крупнолистовой, 100г;129.99;31;1 шт;188.99;https://photos.okolo.app/product/1158241-main/320x320.jpeg
Кофе Coffesso Decaffeinato жареный молотый в капсулах 20х5г;299.99;0.0;1 шт;299.99;https://photos.okolo.app/product/1472440-main/320x320.jpeg
Чай черный Lipton Yellow Label листовой 180г;169.99;29;1 шт;239.99;https://photos.okolo.app/product/1465093-main/320x320.jpeg
Какао-напиток Хрутка быстрорастворимый 250г;109.99;37;1 шт;174.99;https://photos.okolo.app/product/1458217-main/320x320.jpeg
Какао-напиток Хрутка быстрорастворимый 500г;179.99;41;1 шт;304.99;https://photos.okolo.app/product/1458216-main/320x320.jpeg
Кофе в капсулах Caffe Tiziano Bonini Classico жареный молотый 16шт. 112г;449.99;0.0;1 шт;449.99;https://photos.okolo.app/product/1459633-main/320x320.jpeg
Кофе в капсулах Caffe Tiziano Bonini Cappuccino жареный молотый 16 шт. 164г;449.99;0.0;1 шт;449.99;https://photos.okolo.app/product/1459632-main/320x320.jpeg
Чай Tusker черный 100х1.5г;129.99;0.0;1 шт;129.99;https://photos.okolo.app/product/1452167-main/320x320.jpeg
Напиток кофейный Jacobs Классика 3в1 растворимый 13.5г;17.99;0.0;1 шт;17.99;https://photos.okolo.app/product/1450948-main/320x320.jpeg
Чай Необычайный с ароматом лимона черный байховый 20x1.5г;56.19;0.0;1 шт;56.19;https://photos.okolo.app/product/1451315-main/320x320.jpeg
Чай Необычайный с чабрецом черный байховый 20x1.5г;56.19;0.0;1 шт;56.19;https://photos.okolo.app/product/1450308-main/320x320.jpeg
Напиток кофейный Kruger Ice Coffeе Choco растворимый 200гр;54.99;45;1 шт;99.99;https://photos.okolo.app/product/1442988-main/320x320.jpeg
Кофе Venetto Intense растворимый сублимированный 95г;179.99;14;1 шт;209.99;https://photos.okolo.app/product/1413899-main/320x320.jpeg
Чай Assand Apple Orchard черный байховый с добавками 100x1.5г;229.99;0.0;1 шт;229.99;https://photos.okolo.app/product/1414030-main/320x320.jpeg
Напиток Вкус и Польза Расслабление чайный 50г;97.99;11;1 шт;109.99;https://photos.okolo.app/product/1422449-main/320x320.jpeg
Кофе в капсулах Hollandsche Brands Эспрессо 10х5.2г;199.99;0.0;1 шт;199.99;https://photos.okolo.app/product/1449413-main/320x320.jpeg
Кофе Milagro Gold Roast растворимый сублимированный 95 г;229.99;0.0;1 шт;229.99;https://photos.okolo.app/product/1412896-main/320x320.jpeg
Чай черный Assand Кенийский в пакетиках 100х2г;229.99;0.0;1 шт;229.99;https://photos.okolo.app/product/1407514-main/320x320.jpeg
Кофе Venetto растворимый сублимированный 240г;379.99;14;1 шт;439.99;https://photos.okolo.app/product/1402879-main/320x320.jpeg
Кофе растворимый сублимированный Venetto 190г;369.99;0.0;1 шт;369.99;https://photos.okolo.app/product/1213343-main/320x320.jpeg
Кофе Solo Naturale растворимый гранулированный 200г;129.99;0.0;1 шт;129.99;https://photos.okolo.app/product/1219016-main/320x320.jpeg
Чай черный Assand Highborn Earl Grey с ароматом бергамота 100х2г;289.99;0.0;1 шт;289.99;https://photos.okolo.app/product/1211918-main/320x320.jpeg
Кофе Jacobs Monarch натуральный растворимый сублимированный, 210г;829.99;0.0;1 шт;829.99;https://photos.okolo.app/product/1211439-main/320x320.jpeg
Кофе Jardin Голд растворимый сублимированный, 190г;399.99;40;1 шт;669.99;https://photos.okolo.app/product/1210575-main/320x320.jpeg
Кофе Jacobs Caramel натуральный растворимый сублимированный, 95г;524.99;0.0;1 шт;524.99;https://photos.okolo.app/product/1210539-main/320x320.jpeg
Чай Assand Famous Ceylon черный 100х2г;289.99;0.0;1 шт;289.99;https://photos.okolo.app/product/1208307-main/320x320.jpeg
Кофе Красная цена молотый средней обжарки 100г;88.19;0.0;1 шт;88.19;https://photos.okolo.app/product/1207788-main/320x320.jpeg
Чай Assand Jasmine Blossom зеленый с жасмином 25х2г;88.99;0.0;1 шт;88.99;https://photos.okolo.app/product/1207167-main/320x320.jpeg
Кофе Venetto натуральный растворимый, 95г;179.99;14;1 шт;209.99;https://photos.okolo.app/product/1206718-main/320x320.jpeg
Кофе в капсулах Jardin Allonge, 10х5.5г;279.99;0.0;1 шт;279.99;https://photos.okolo.app/product/1440504-main/320x320.jpeg
Чай Assand Milk Oolong Молочный Улун зелёный с молочным ароматом, 25x2г;84.99;0.0;1 шт;84.99;https://photos.okolo.app/product/1206335-main/320x320.jpeg
Напиток кофейный Nescafé 3в1 мягкий растворимый 14.5г;18.99;0.0;1 шт;18.99;https://photos.okolo.app/product/1205149-main/320x320.jpeg
Напиток кофейный Nescafé 3в1 классик растворимый 14.5г;18.99;0.0;1 шт;18.99;https://photos.okolo.app/product/1205148-main/320x320.jpeg
Напиток кофейный Nescafé 3в1 крепкий растворимый 14.5г;18.99;0.0;1 шт;18.99;https://photos.okolo.app/product/1205147-main/320x320.jpeg
Кофе Paulig Classic crema в зернах 1кг;1299.00;13;1 шт;1493.85;https://photos.okolo.app/product/1241026-main/320x320.jpeg
Кофе Nescafe Classic растворимый 60г;99.99;0.0;1 шт;99.99;https://photos.okolo.app/product/1357907-main/320x320.jpeg
Кофе Nescafe Classic растворимый 190г;249.99;0.0;1 шт;249.99;https://photos.okolo.app/product/1202499-main/320x320.jpeg
Кофе Jacobs Barista Editions Crema натуральный жареный молотый, 230г;349.99;38;1 шт;559.99;https://photos.okolo.app/product/1202399-main/320x320.jpeg
Кофе Venetto растворимый сублимированный, 95г;179.99;14;1 шт;209.99;https://photos.okolo.app/product/1201339-main/320x320.jpeg
Напиток чайный Assand ромашка в пакетиках, 25х1.5г;74.99;12;1 шт;84.99;https://photos.okolo.app/product/1200944-main/320x320.jpeg
Чай Assand зелёный с мелиссой 25x1.5г;88.99;0.0;1 шт;88.99;https://photos.okolo.app/product/1200846-main/320x320.jpeg
Кофе Красная Цена растворимый сублимированный 70г;74.49;0.0;1 шт;74.49;https://photos.okolo.app/product/1200407-main/320x320.jpeg
Цикорий растворимый Большая чашка натуральный растворимый, 85г;209.99;30;1 шт;299.99;https://photos.okolo.app/product/1199122-main/320x320.jpeg
Напиток кофейный Nescafé Classic Cappuccino растворимый 18г;24.69;18;1 шт;29.99;https://photos.okolo.app/product/1194554-main/320x320.jpeg
Кофе Nescafe Gold растворимый 190г;734.99;0.0;1 шт;734.99;https://photos.okolo.app/product/1194547-main/320x320.jpeg
Кофе Nescafé Gold растворимый 130г;299.99;44;1 шт;539.99;https://photos.okolo.app/product/1194546-main/320x320.jpeg
Кофе Fresco Doppio растворимый с добавлением молотого, 100г;249.99;46;1 шт;459.99;https://photos.okolo.app/product/1192232-main/320x320.jpeg
Чай Assand черный с чабрецом 25х2г;84.99;0.0;1 шт;84.99;https://photos.okolo.app/product/1190400-main/320x320.jpeg
Чай Assand Authentic чёрный с мятой в пакетиках 25x2г;84.99;0.0;1 шт;84.99;https://photos.okolo.app/product/1190399-main/320x320.jpeg
Какао-напиток Ухтышки растворимый с витаминами 300г;139.99;0.0;1 шт;139.99;https://photos.okolo.app/product/1189990-main/320x320.jpeg
Кофе в капсулах Jardin Vivo молотый 10x5г;279.99;0.0;1 шт;279.99;https://photos.okolo.app/product/1455788-main/320x320.jpeg
Кофе в капсулах Jardin Andante молотый 10x5г;279.99;0.0;1 шт;279.99;https://photos.okolo.app/product/1458131-main/320x320.jpeg
Кофе в капсулах Jardin Ristretto молотый, 10x5г;279.99;0.0;1 шт;279.99;https://photos.okolo.app/product/1188125-main/320x320.jpeg
Кофе в капсулах Jardin Vanillia молотый 10x5г;279.99;0.0;1 шт;279.99;https://photos.okolo.app/product/1188121-main/320x320.jpeg
Чай Азерчай Букет чёрный байховый в пакетиках, 100х2г;179.99;44;1 шт;319.99;https://photos.okolo.app/product/1187794-main/320x320.jpeg
Кофе Nescafé Gold растворимый 95г;478.99;0.0;1 шт;478.99;https://photos.okolo.app/product/1187280-main/320x320.jpeg
Кофе Nescafé Gold растворимый 75г;179.99;50;1 шт;359.99;https://photos.okolo.app/product/1187257-main/320x320.jpeg
Кофе Nescafé Gold растворимый 190г;399.99;52;1 шт;839.99;https://photos.okolo.app/product/1187187-main/320x320.jpeg
Кофе Красная Цена растворимый 70г;79.99;0.0;1 шт;79.99;https://photos.okolo.app/product/1186964-main/320x320.jpeg
Чай Curtis Blue Berries Blues черный в пирамидках 20х1.8г;89.99;36;1 шт;139.99;https://photos.okolo.app/product/1186076-main/320x320.jpeg
Чай Азерчай Букет чёрный байховый 25х2г;59.99;0.0;1 шт;59.99;https://photos.okolo.app/product/1185963-main/320x320.jpeg
Кофе Черная Карта в зёрнах, 800г;649.99;0.0;1 шт;649.99;https://photos.okolo.app/product/1185879-main/320x320.jpeg
Кофе Jacobs Monarch классический натуральный жареный в зёрнах, 800г;1294.00;0.0;1 шт;1294.00;https://photos.okolo.app/product/1179132-main/320x320.jpeg
Кофе Jacobs Monarch классический натуральный жареный в зёрнах 230г;269.99;33;1 шт;399.99;https://photos.okolo.app/product/1179040-main/320x320.jpeg
Кофе Carte Noire Original жареный в зёрнах 800г;1099.00;0.0;1 шт;1099.00;https://photos.okolo.app/product/1177199-main/320x320.jpeg
Кофе Nescafé Classic Crema растворимый 95г;199.99;31;1 шт;289.99;https://photos.okolo.app/product/1175942-main/320x320.jpeg
Чай черный Richard Lord Grey 90г;119.99;25;1 шт;159.99;https://photos.okolo.app/product/1174927-main/320x320.jpeg
Чай Tess Pleasure черный шиповник-яблоко в пакетиках 100шт.;239.99;29;1 шт;335.99;https://photos.okolo.app/product/1174846-main/320x320.jpeg
Чай Лисма Насыщеный чёрный в пакетиках, 25х1.8г;42.99;0.0;1 шт;42.99;https://photos.okolo.app/product/1174555-main/320x320.jpeg
Кофе Tchibo Gold Selection растворимый, 95г;137.49;45;1 шт;249.99;https://photos.okolo.app/product/1174114-main/320x320.jpeg
Чай Greenfield Spring Melody чёрный, 100г;129.99;31;1 шт;188.99;https://photos.okolo.app/product/1174083-main/320x320.jpeg
Кофе Tchibo Gold Mokka молотый, 250г;199.99;0.0;1 шт;199.99;https://photos.okolo.app/product/1173971-main/320x320.jpeg
Кофе Jacobs Monarch натуральный растворимый сублимированный, 1.8г;18.65;0.0;1 шт;18.65;https://photos.okolo.app/product/1173630-main/320x320.jpeg
Чай черный Крепкие традиции Цейлонский крупнолистовой 250 г;139.99;0.0;1 шт;139.99;https://photos.okolo.app/product/1173377-main/320x320.jpeg
Чай Richard Роял Цейлон чёрный байховый в пакетиках, 100х2г;419.99;0.0;1 шт;419.99;https://photos.okolo.app/product/1172865-main/320x320.jpeg
Кофе Jacobs Velour натуральный растворимый порошкообразный, 70г;179.99;0.0;1 шт;179.99;https://photos.okolo.app/product/1172701-main/320x320.jpeg
Чай Азерчай Букет чёрный байховый крупнолистовой, 200г;229.99;31;1 шт;334.99;https://photos.okolo.app/product/1172240-main/320x320.jpeg
Чай Азерчай Букет чёрный байховый крупнолистовой, 100г;109.99;0.0;1 шт;109.99;https://photos.okolo.app/product/1172237-main/320x320.jpeg
Кофе Migel Classic натуральный растворимый гранулированный 75г;119.99;0.0;1 шт;119.99;https://photos.okolo.app/product/1172007-main/320x320.jpeg
Кофе Migel Gold растворимый сублимированный, 75г;116.99;13;1 шт;134.54;https://photos.okolo.app/product/1172006-main/320x320.jpeg
Чай Lipton чёрный байховый в пакетиках, 100х2г;219.99;44;1 шт;389.99;https://photos.okolo.app/product/1170691-main/320x320.jpeg
Кофе Nescafé Gold Barista растворимый 75г;179.99;0.0;1 шт;179.99;https://photos.okolo.app/product/1170216-main/320x320.jpeg
Чай Richard Lord Grey черный байховый 25х2г;94.99;37;1 шт;149.99;https://photos.okolo.app/product/1170084-main/320x320.jpeg
Чай Greenfield Грин мелисса зелёный с ароматом мяты и лимона в пакетиках, 100х1.5г;299.99;32;1 шт;439.99;https://photos.okolo.app/product/1169435-main/320x320.jpeg
Чай черный Assand Earl Grey, 25х2г;88.99;0.0;1 шт;88.99;https://photos.okolo.app/product/1168157-main/320x320.jpeg
Чай черный Assand Цейлонский 25 пак.;88.99;0.0;1 шт;88.99;https://photos.okolo.app/product/1168156-main/320x320.jpeg
Чай Крепкие Традиции чёрный байховый в пакетиках, 100х2г;154.99;0.0;1 шт;154.99;https://photos.okolo.app/product/1168155-main/320x320.jpeg
Чай Крепкие Традиции черный 25х2г;42.99;0.0;1 шт;42.99;https://photos.okolo.app/product/1168154-main/320x320.jpeg
Чай Curtis Fresh Mojito зеленый 20х1.7г;89.99;36;1 шт;139.99;https://photos.okolo.app/product/1167826-main/320x320.jpeg
Чай Greenfield Kenyan Sunrise чёрный в пакетиках, 100х2г;439.99;0.0;1 шт;439.99;https://photos.okolo.app/product/1167730-main/320x320.jpeg
Чай Greenfield Золотой Цейлон чёрный цейлонский листовой, 200г;229.99;28;1 шт;319.99;https://photos.okolo.app/product/1167725-main/320x320.jpeg
Чай Curtis Sunny Lemon чёрный в пакетиках, 20х1.47г;89.99;36;1 шт;139.99;https://photos.okolo.app/product/1167460-main/320x320.jpeg
Кофе Jacobs Monarch натуральный растворимый сублимированный 150г;649.99;0.0;1 шт;649.99;https://photos.okolo.app/product/1167445-main/320x320.jpeg
Кофе Fresco Arabica Blend растворимый сублимированный, 100г;249.99;46;1 шт;459.99;https://photos.okolo.app/product/1166786-main/320x320.jpeg
Чай Akbar Цейлон чёрный в пакетиках, 100х2г;219.99;39;1 шт;359.99;https://photos.okolo.app/product/1165754-main/320x320.jpeg
Чай Красная Цена черный мелколистовой 100г;19.99;0.0;1 шт;19.99;https://photos.okolo.app/product/1165551-main/320x320.jpeg
Чай Красная Цена чёрный 20 пакетиков;16.99;0.0;1 шт;16.99;https://photos.okolo.app/product/1162870-main/320x320.jpeg
Чай Лисма чёрный байховый индийский крепкий в пакетиках, 100х2г;149.99;0.0;1 шт;149.99;https://photos.okolo.app/product/1162567-main/320x320.jpeg
Напиток MacCoffee кофейный растворимый 3в1 оригинал 10x20г;119.90;0.0;1 шт;119.90;https://photos.okolo.app/product/1162412-main/320x320.jpeg
Кофе Jardin Colombia Medellin растворимый сублимированный, 95г;239.99;40;1 шт;399.99;https://photos.okolo.app/product/1161969-main/320x320.jpeg
Кофе Жокей По-восточному натуральный жареный молотый, 250г;229.99;34;1 шт;349.99;https://photos.okolo.app/product/1157850-main/320x320.jpeg
Кофе Jacobs Monarch натуральный растворимый сублимированный, 95г;269.99;27;1 шт;369.99;https://photos.okolo.app/product/1157801-main/320x320.jpeg
Чай Greenfield Earl Grey Fantasy чёрный в пакетиках, 100х2г;299.99;32;1 шт;439.99;https://photos.okolo.app/product/1161213-main/320x320.jpeg
Чай черный Greenfield Golden Ceylon 100шт.;289.99;34;1 шт;439.99;https://photos.okolo.app/product/1161212-main/320x320.jpeg
Чай Tess Лайм зелёный в пакетиках, 25х1.5г;79.99;33;1 шт;119.99;https://photos.okolo.app/product/1161013-main/320x320.jpeg
Чай Принцесса Гита чёрный 100г;109.99;0.0;1 шт;109.99;https://photos.okolo.app/product/1457536-main/320x320.jpeg
Чай Greenfield Earl Grey Fantasy чёрный в пакетиках, 25х2г;89.99;31;1 шт;129.99;https://photos.okolo.app/product/1160232-main/320x320.jpeg
Чай Принцесса Нури Высокогорный чёрный в пакетиках 100х2г;249.99;0.0;1 шт;249.99;https://photos.okolo.app/product/1160151-main/320x320.jpeg
Чай Greenfield Summer Bouquet травяной в пакетиках, 25х2г;129.99;0.0;1 шт;129.99;https://photos.okolo.app/product/1160150-main/320x320.jpeg
Чай Greenfield Earl Grey Fantasy чёрный крупнолистовой, 100г;129.99;28;1 шт;179.99;https://photos.okolo.app/product/1160146-main/320x320.jpeg
Кофе молотый Жокей По-восточному 100г;142.99;0.0;1 шт;142.99;https://photos.okolo.app/product/1458804-main/320x320.jpeg
Чай Beta Tea ОРА чёрный байховый высшего сорта 250г;259.99;24;1 шт;339.99;https://photos.okolo.app/product/1159886-main/320x320.jpeg
Чай Майский Корона Российской Империи чёрный цейлонский листовой, 100г;146.99;0.0;1 шт;146.99;https://photos.okolo.app/product/1159815-main/320x320.jpeg
Чай Майский Корона Российской Империи чёрный, 200г;272.99;0.0;1 шт;272.99;https://photos.okolo.app/product/1157477-main/320x320.jpeg
Напиток чайный Принцесса Ява Высокогорный листовой, 80г;59.99;0.0;1 шт;59.99;https://photos.okolo.app/product/1157365-main/320x320.jpeg
Черный чай Lipton Yellow Label в пакетиках 100шт.;377.99;0.0;1 шт;377.99;https://photos.okolo.app/product/1157353-main/320x320.jpeg
